URL,Title,Sentence
https://www1.cgmh.org.tw/intr/intr5/c6210/mastitis.html,乳腺炎- 嘉義長庚一般外科 - 長庚醫院,乳腺炎的危險因子：
https://www1.cgmh.org.tw/intr/intr5/c6210/mastitis.html,乳腺炎- 嘉義長庚一般外科 - 長庚醫院,有乳腺炎病史者，
https://www1.cgmh.org.tw/intr/intr5/c6210/mastitis.html,乳腺炎- 嘉義長庚一般外科 - 長庚醫院,復發乳腺炎
https://www1.cgmh.org.tw/intr/intr5/c6210/mastitis.html,乳腺炎- 嘉義長庚一般外科 - 長庚醫院,乳腺炎併發膿瘍：
https://www1.cgmh.org.tw/intr/intr5/c6210/mastitis.html,乳腺炎- 嘉義長庚一般外科 - 長庚醫院,乳腺炎時可哺乳嗎？
https://www1.cgmh.org.tw/intr/intr5/c6210/mastitis.html,乳腺炎- 嘉義長庚一般外科 - 長庚醫院,雖然乳腺炎可能增加妳餵奶時的疼痛，但妳不需要因此停止餵奶，甚至患側也可以餵奶，母親服用的大多數抗生素和止痛藥對寶寶並不會造成影響，持續的哺乳可幫忙妳疏通妳阻塞的乳管，提供乳房清除感染、避免乳腺炎持續惡化的額外好處。
https://www1.cgmh.org.tw/intr/intr5/c6210/mastitis.html,乳腺炎- 嘉義長庚一般外科 - 長庚醫院,如何預防產褥期的乳腺炎？
https://www1.cgmh.org.tw/intr/intr5/c6210/mastitis.html,乳腺炎- 嘉義長庚一般外科 - 長庚醫院,如果有乳腺炎症狀持續超過24小時仍無法改善，應就醫進一步診療。
http://languages.cancercouncil.com.au/zh-hant/%E6%8C%89%E7%99%8C%E7%97%87%E7%A8%AE%E9%A1%9E/%E4%B9%B3%E8%85%BA%E7%99%8C/,乳腺癌| Cancer Council,乳腺癌|
http://languages.cancercouncil.com.au/zh-hant/%E6%8C%89%E7%99%8C%E7%97%87%E7%A8%AE%E9%A1%9E/%E4%B9%B3%E8%85%BA%E7%99%8C/,乳腺癌| Cancer Council,乳腺癌
http://languages.cancercouncil.com.au/zh-hant/%E6%8C%89%E7%99%8C%E7%97%87%E7%A8%AE%E9%A1%9E/%E4%B9%B3%E8%85%BA%E7%99%8C/,乳腺癌| Cancer Council,乳腺癌
http://languages.cancercouncil.com.au/zh-hant/%E6%8C%89%E7%99%8C%E7%97%87%E7%A8%AE%E9%A1%9E/%E4%B9%B3%E8%85%BA%E7%99%8C/,乳腺癌| Cancer Council,乳腺癌發生於乳腺管或小葉。
http://languages.cancercouncil.com.au/zh-hant/%E6%8C%89%E7%99%8C%E7%97%87%E7%A8%AE%E9%A1%9E/%E4%B9%B3%E8%85%BA%E7%99%8C/,乳腺癌| Cancer Council,乳腺管或小葉內層的細胞若生長失控會發展成癌症。
http://languages.cancercouncil.com.au/zh-hant/%E6%8C%89%E7%99%8C%E7%97%87%E7%A8%AE%E9%A1%9E/%E4%B9%B3%E8%85%BA%E7%99%8C/,乳腺癌| Cancer Council,有些乳腺癌被發現時，仍侷限於乳腺管或小葉。
http://languages.cancercouncil.com.au/zh-hant/%E6%8C%89%E7%99%8C%E7%97%87%E7%A8%AE%E9%A1%9E/%E4%B9%B3%E8%85%BA%E7%99%8C/,乳腺癌| Cancer Council,最常見的類型是乳腺管原位癌（DCIS）和小葉原位癌（LCIS）。
http://languages.cancercouncil.com.au/zh-hant/%E6%8C%89%E7%99%8C%E7%97%87%E7%A8%AE%E9%A1%9E/%E4%B9%B3%E8%85%BA%E7%99%8C/,乳腺癌| Cancer Council,大多數乳腺癌被發現時已經處於侵襲階段。
http://languages.cancercouncil.com.au/zh-hant/%E6%8C%89%E7%99%8C%E7%97%87%E7%A8%AE%E9%A1%9E/%E4%B9%B3%E8%85%BA%E7%99%8C/,乳腺癌| Cancer Council,這意味著癌細胞已經超出乳腺管或小葉範圍而向周圍組織蔓延。
http://languages.cancercouncil.com.au/zh-hant/%E6%8C%89%E7%99%8C%E7%97%87%E7%A8%AE%E9%A1%9E/%E4%B9%B3%E8%85%BA%E7%99%8C/,乳腺癌| Cancer Council,乳腺癌是澳大利亞婦女最常見的癌症。
http://languages.cancercouncil.com.au/zh-hant/%E6%8C%89%E7%99%8C%E7%97%87%E7%A8%AE%E9%A1%9E/%E4%B9%B3%E8%85%BA%E7%99%8C/,乳腺癌| Cancer Council,每年大約有13000名婦女被診斷出患有乳腺癌。
http://languages.cancercouncil.com.au/zh-hant/%E6%8C%89%E7%99%8C%E7%97%87%E7%A8%AE%E9%A1%9E/%E4%B9%B3%E8%85%BA%E7%99%8C/,乳腺癌| Cancer Council,乳腺癌可以在任何年齡發生。
http://languages.cancercouncil.com.au/zh-hant/%E6%8C%89%E7%99%8C%E7%97%87%E7%A8%AE%E9%A1%9E/%E4%B9%B3%E8%85%BA%E7%99%8C/,乳腺癌| Cancer Council,引發乳腺癌的確切原因尚不清楚，但一些因素能增加乳腺癌的風險。
http://languages.cancercouncil.com.au/zh-hant/%E6%8C%89%E7%99%8C%E7%97%87%E7%A8%AE%E9%A1%9E/%E4%B9%B3%E8%85%BA%E7%99%8C/,乳腺癌| Cancer Council,少數（約5%或者20人裡有1人）的遺傳基因故障可能會導致乳腺癌。
http://languages.cancercouncil.com.au/zh-hant/%E6%8C%89%E7%99%8C%E7%97%87%E7%A8%AE%E9%A1%9E/%E4%B9%B3%E8%85%BA%E7%99%8C/,乳腺癌| Cancer Council,這些變化並不一定意味著你得了乳腺癌。
http://languages.cancercouncil.com.au/zh-hant/%E6%8C%89%E7%99%8C%E7%97%87%E7%A8%AE%E9%A1%9E/%E4%B9%B3%E8%85%BA%E7%99%8C/,乳腺癌| Cancer Council,有些婦女沒有任何症狀，但可能透過乳房X光普查發現乳腺癌。
http://languages.cancercouncil.com.au/zh-hant/%E6%8C%89%E7%99%8C%E7%97%87%E7%A8%AE%E9%A1%9E/%E4%B9%B3%E8%85%BA%E7%99%8C/,乳腺癌| Cancer Council,乳房X光檢查期間，兩側乳房都需夾在兩個X射線板中間，這能拉伸乳腺組織，以便能拍攝到清晰的照片。
http://languages.cancercouncil.com.au/zh-hant/%E6%8C%89%E7%99%8C%E7%97%87%E7%A8%AE%E9%A1%9E/%E4%B9%B3%E8%85%BA%E7%99%8C/,乳腺癌| Cancer Council,活組織檢查的意思是取出少量的乳腺組織進行測試。
http://languages.cancercouncil.com.au/zh-hant/%E6%8C%89%E7%99%8C%E7%97%87%E7%A8%AE%E9%A1%9E/%E4%B9%B3%E8%85%BA%E7%99%8C/,乳腺癌| Cancer Council,使用從I至IV的數字作為乳腺癌的分期編號。
http://languages.cancercouncil.com.au/zh-hant/%E6%8C%89%E7%99%8C%E7%97%87%E7%A8%AE%E9%A1%9E/%E4%B9%B3%E8%85%BA%E7%99%8C/,乳腺癌| Cancer Council,以下是早期乳腺癌的分期：
http://languages.cancercouncil.com.au/zh-hant/%E6%8C%89%E7%99%8C%E7%97%87%E7%A8%AE%E9%A1%9E/%E4%B9%B3%E8%85%BA%E7%99%8C/,乳腺癌| Cancer Council,IIB（晚期）到第III和第IV期是指晚期的乳腺癌。
https://health.tvbs.com.tw/medical/319139,「這種人」有乳腺炎恐是乳癌！3徵兆快就醫｜健康2.0,「這種人」有乳腺炎恐是乳癌！3徵兆快就醫｜健康2.0
https://health.tvbs.com.tw/medical/319139,「這種人」有乳腺炎恐是乳癌！3徵兆快就醫｜健康2.0,「這種人」有乳腺炎恐是乳癌！3徵兆快就醫
https://health.tvbs.com.tw/medical/319139,「這種人」有乳腺炎恐是乳癌！3徵兆快就醫｜健康2.0,乳腺炎是多數哺乳媽媽的夢魘，乳房又痛又腫相當難受。
https://health.tvbs.com.tw/medical/319139,「這種人」有乳腺炎恐是乳癌！3徵兆快就醫｜健康2.0,不過，醫師提醒，若是妳未懷孕生產卻發生乳腺炎，乳房紅腫熱痛、有硬塊，甚至有汁液滲出，恐是乳癌的徵兆。
https://health.tvbs.com.tw/medical/319139,「這種人」有乳腺炎恐是乳癌！3徵兆快就醫｜健康2.0,婦產科醫師楊于萱指出，乳腺炎可分為哺乳期乳腺炎及非哺乳期乳腺炎，哺乳期乳腺炎較為常見，主要發生原因為乳腺不通、壓迫乳腺，以及乳腺中金黃色葡萄球菌增生，造成乳腺菌叢失衡；而非哺乳期乳腺炎的原因可能是乳癌徵兆、內分泌失調、抽菸等原因。
https://health.tvbs.com.tw/medical/319139,「這種人」有乳腺炎恐是乳癌！3徵兆快就醫｜健康2.0,延伸閱讀：不只哺乳媽！10大族群也易得乳腺炎，醫教3招預防很簡單
https://health.tvbs.com.tw/medical/319139,「這種人」有乳腺炎恐是乳癌！3徵兆快就醫｜健康2.0,楊于萱強調，若是發生非哺乳期乳腺炎要特別留意，合併乳房紅腫熱痛、有硬塊，甚至有汁液滲出，有可能是乳癌的徵兆，建議進一步就醫檢查。
https://health.tvbs.com.tw/medical/319139,「這種人」有乳腺炎恐是乳癌！3徵兆快就醫｜健康2.0,金黃色葡萄球菌導致乳腺炎發生
https://health.tvbs.com.tw/medical/319139,「這種人」有乳腺炎恐是乳癌！3徵兆快就醫｜健康2.0,婦幼營養科學博士伊夫琳·斯皮維指出，乳腺非無菌環境，且乳腺中有高達100種的菌種，像是雙歧桿菌、乳酸桿菌等好菌，可以幫助孩童免疫系統成熟，以及金黃色葡萄球菌等壞菌，造成乳腺炎的發生。
https://health.tvbs.com.tw/medical/319139,「這種人」有乳腺炎恐是乳癌！3徵兆快就醫｜健康2.0,伊夫琳·斯皮維說明，目前治療乳腺炎以抗生素為主，可能連同好菌一起消滅，長期使用更可能使金黃色葡萄球菌產生抗藥性，乳腺炎復發機率達30％，加重乳房疼痛的症狀。
https://health.tvbs.com.tw/medical/319139,「這種人」有乳腺炎恐是乳癌！3徵兆快就醫｜健康2.0,根據研究顯示，孕期間可以補充益生菌，有助乳腺菌叢平衡，降低乳腺炎發生率。
https://health.tvbs.com.tw/medical/319139,「這種人」有乳腺炎恐是乳癌！3徵兆快就醫｜健康2.0,5招預防乳腺炎
https://health.tvbs.com.tw/medical/319139,「這種人」有乳腺炎恐是乳癌！3徵兆快就醫｜健康2.0,楊于萱提醒，如果發現塞奶硬塊應即時處理，應親喂或輕柔擠乳將乳汁排出，她也提供5招預防乳腺炎：
https://health.tvbs.com.tw/medical/319139,「這種人」有乳腺炎恐是乳癌！3徵兆快就醫｜健康2.0,忍氣吞聲會內傷！彥寬老師「吐悶氣法」預防乳癌、乳腺增生、便祕
https://health.tvbs.com.tw/medical/319139,「這種人」有乳腺炎恐是乳癌！3徵兆快就醫｜健康2.0,乳腺炎乳癌乳房紅腫熱痛乳房硬塊楊于萱
https://health.tvbs.com.tw/medical/319139,「這種人」有乳腺炎恐是乳癌！3徵兆快就醫｜健康2.0,下一則：不只哺乳媽！10大族群也易得乳腺炎，醫教3招預防很簡單
https://www.careonline.com.tw/2018/12/breast-cyst.html,常見的乳房囊腫與纖維腺瘤（懶人包） - 照護線上,首先，乳房摸起來真的不是完完全全軟嫩的，因為除了脂肪組織外，乳房內還有乳腺組織和結締組織來負責哺乳及支撐乳房。
https://www.careonline.com.tw/2018/12/breast-cyst.html,常見的乳房囊腫與纖維腺瘤（懶人包） - 照護線上,我們的乳頭就像個花灑一樣，上面有好幾個乳管的開口，這些乳管從乳頭呈現放射狀的排列，總共是大約有十五到二十串的乳腺腺葉，每一個乳腺腺葉裡又能分成很多腺小葉，就像一串葡萄這樣，乳腺組織分泌乳汁後，從各個分支的管路最後會匯集進到輸乳管，再從乳頭排出。
https://www.careonline.com.tw/2018/12/breast-cyst.html,常見的乳房囊腫與纖維腺瘤（懶人包） - 照護線上,脂肪組織、乳腺組織、結締組織這三種組織的比例會隨著身體狀況變化，因而改變乳房的外型。
https://www.careonline.com.tw/2018/12/breast-cyst.html,常見的乳房囊腫與纖維腺瘤（懶人包） - 照護線上,假使是脂肪組織厚實一點的人，乳房觸碰起來會比較均質軟嫩；如果脂肪不多，觸碰乳房時直接就會摸到乳腺及結締組織，比較容易會有一塊塊、不那麼均質，甚至覺得有點硬硬的紮實感覺。
https://www.careonline.com.tw/2018/12/breast-cyst.html,常見的乳房囊腫與纖維腺瘤（懶人包） - 照護線上,乳房囊腫是發生率很高的乳房良性變化，代表乳腺裡面有液體蓄積，而這樣的液體堆積很像水球，女生自己摸到時會覺得這個東西摸起來腫腫硬硬的，表面平滑，可以滑動，而且和周邊分界明顯。
https://www.careonline.com.tw/2018/12/breast-cyst.html,常見的乳房囊腫與纖維腺瘤（懶人包） - 照護線上,乳房纖維腺瘤的出現依舊與荷爾蒙的刺激有關，讓乳腺腺葉增生成一個實心的腫瘤，停經之後，這些纖維腺瘤常會自己停止生長。
https://moonsyne.pixnet.net/blog/post/67301307,[分享] 乳腺炎@ 慕璽MOONSYNE :: 痞客邦::,[分享]乳腺炎@慕璽MOONSYNE::痞客邦::
https://moonsyne.pixnet.net/blog/post/67301307,[分享] 乳腺炎@ 慕璽MOONSYNE :: 痞客邦::,[分享]乳腺炎
https://moonsyne.pixnet.net/blog/post/67301307,[分享] 乳腺炎@ 慕璽MOONSYNE :: 痞客邦::,乳腺炎，更要繼續哺乳喔
https://moonsyne.pixnet.net/blog/post/67301307,[分享] 乳腺炎@ 慕璽MOONSYNE :: 痞客邦::,「乳管阻塞」是母乳媽媽極可能會遇到的困擾，日前有國際母哺專家提出，吃卵磷脂可預防乳腺阻塞，對此，國內醫師如何解讀？而母乳媽媽都知道即便得了乳腺炎，還是可以利用一些舒緩疼痛的方式來改善症狀，而且最好的治療就是「繼續餵」，究竟該如何繼續餵？有沒有什麼秘訣呢？文／王文珠採訪諮詢／謝璧光小兒科診所醫師謝璧光林口長庚兒童醫院新生兒科主任醫師周怡宏日前國民健康局的母乳充電報曾拋出一篇翻譯，來自加拿大著名的母哺專家，傑克．紐曼醫師（Dr.JackNewman）所撰寫關於：「卵磷脂可預防乳腺阻塞」。
https://moonsyne.pixnet.net/blog/post/67301307,[分享] 乳腺炎@ 慕璽MOONSYNE :: 痞客邦::,卵磷脂可預防乳腺炎？文中提到：「補充卵磷脂這種食物，可能對某些媽媽預防乳腺阻塞有幫助。
https://moonsyne.pixnet.net/blog/post/67301307,[分享] 乳腺炎@ 慕璽MOONSYNE :: 痞客邦::,」看到這項訊息，在堅持母乳哺餵過程中，經常會受乳腺阻塞干擾的媽媽來說，應該是一大福音，但真正的解讀意義是什麼呢？在台灣推動母奶哺餵不遺餘力的謝璧光小兒科診所醫師謝璧光表示：「目前還沒有看到這方面的臨床報告出爐，也不是所有餵母奶的媽媽都要刻意去補充卵磷脂，這是針對有反覆性乳管阻塞的人所做的建議。
https://moonsyne.pixnet.net/blog/post/67301307,[分享] 乳腺炎@ 慕璽MOONSYNE :: 痞客邦::,」而林口長庚兒童醫院新生兒科主任醫師周怡宏也認為，傑克．紐曼醫師致力於母乳的相關研究已是國際間有目共睹，他也曾經受邀來台演講，這次他所發表的：藉由攝取卵磷脂改變母乳黏稠性，進而減低乳腺阻塞機率，應該十分可信。
https://moonsyne.pixnet.net/blog/post/67301307,[分享] 乳腺炎@ 慕璽MOONSYNE :: 痞客邦::,持續哺餵是唯一正道那麼，在哺餵母奶時，若不慎發生乳腺炎該怎麼辦呢？謝璧光醫師說：「原則上還是要繼續餵，因為導致乳腺的原因不明，而其中最常見的一個就是，沒有充分排空乳汁、乳管阻塞了，但因為乳管阻塞嚴重者，乳房通常會非常的疼痛，所以『勇敢排出』，不論妳是手擠或者哺餵，就是要想辦法把膿汁清光囉！」的確，很多母奶媽媽都知道，若有脹奶嚴重困擾或已有乳腺炎症狀，最好的解決方法就是繼續餵，雖然會不舒服，但醫師或母乳推廣的輔導員會教導一些舒緩疼痛的祕訣，例如：冷敷等。
https://moonsyne.pixnet.net/blog/post/67301307,[分享] 乳腺炎@ 慕璽MOONSYNE :: 痞客邦::,以下就為大家整理並提醒一些小地方大關鍵的乳腺炎餵奶技巧：小地方往往是大關鍵訣竅1餵前冷敷的話，要注意不要碰到乳暈附近，以避免降低噴乳反射．寶寶會吸不到奶水喔！
https://moonsyne.pixnet.net/blog/post/67301307,[分享] 乳腺炎@ 慕璽MOONSYNE :: 痞客邦::,提醒妳每兩小時，或是葉子變軟了就要換掉喔！訣竅5淋浴吧！讓溫熱水衝擊妳的背後，使自己放鬆，記得一邊沖水一邊按摩乳房喔！訣竅6坐著，用一盆溫水放在膝蓋上．將上身彎向膝蓋，使乳房泡在臉盆裡．輕輕搖晃妳的乳房，藉著重力可使妳的奶水比較容易流出來喔！乳腺炎就醫掛哪一科？發燒超過24小時，或者痛得實在無法忍受時，到醫院一趟吧！謝璧光醫師表示，可以請醫師給妳短效的止痛藥，或者治療乳腺炎時雖然使用抗生素，但對寶寶並沒有影響，媽媽可以安心。
https://moonsyne.pixnet.net/blog/post/67301307,[分享] 乳腺炎@ 慕璽MOONSYNE :: 痞客邦::,通常，當乳房的奶水被吸出來後，乳管阻塞或乳腺炎會在一天內獲得改善．如果症狀非常嚴重，已經有明顯的發燒、疲憊，或是乳頭也有破皮皸裂的狀況，甚至症狀在奶水被吸出來後24小時仍未改善時，就可判斷是乳腺炎了。
https://moonsyne.pixnet.net/blog/post/67301307,[分享] 乳腺炎@ 慕璽MOONSYNE :: 痞客邦::,謝璧光醫師補充道：「臨床上，乳腺炎的定義是指：發燒已超過24小時，乳房紅腫且有硬塊。
https://moonsyne.pixnet.net/blog/post/67301307,[分享] 乳腺炎@ 慕璽MOONSYNE :: 痞客邦::,」而乳腺炎就醫時，謝璧光醫師認為，選擇的醫生很重要，她說：「無論婦產科或小兒科醫師均可，但醫師最好是有心在推廣母乳的，因為他對於改善乳腺炎會有較多的資訊可以提供，而不是嚴重的就叫妳打退奶針，等於提早終止妳的哺乳計畫，那將得不償失囉！」為何乳管阻塞還可繼續餵？乳腺炎大致上可以分成兩種；一種是單純的乳汁沒有被完全排空，造成乳房組織發炎，稱為「非感染性乳腺炎」；另一種是乳房被細菌感染了，稱為「感染性乳腺炎」。
https://moonsyne.pixnet.net/blog/post/67301307,[分享] 乳腺炎@ 慕璽MOONSYNE :: 痞客邦::,【因為】謝璧光醫師表示，不論是哪一種的乳腺炎，乳管阻塞或受感染阻塞並不見得是雙邊乳房的所有乳管都塞住了，較多的媽媽是單邊乳房或部分乳管阻塞而已，所以仍可以持續餵寶寶吃奶，而感染型乳腺炎的媽媽也可放心繼續哺餵，因為這種感染並不會傳染給寶寶。
https://moonsyne.pixnet.net/blog/post/67301307,[分享] 乳腺炎@ 慕璽MOONSYNE :: 痞客邦::,Checkup輸乳管阻塞和乳腺炎原因(以下資料來自／台中榮民總醫院兒童醫學部母乳哺育專區陳昭惠醫師)當輸乳管阻塞及發生乳腺炎時，有兩種狀況：狀況1.整個或部分乳房的奶水沒有被吸出來原因1.奶餵得不夠多＊媽媽太忙碌較少餵食。
https://moonsyne.pixnet.net/blog/post/67301307,[分享] 乳腺炎@ 慕璽MOONSYNE :: 痞客邦::,原因4.外力傷害＊乳房外傷傷害到組織時也會造成乳腺炎，例如，突然的撞擊，或是意外地被較大的孩子踢到。
https://moonsyne.pixnet.net/blog/post/67301307,[分享] 乳腺炎@ 慕璽MOONSYNE :: 痞客邦::,＊如有乳頭皸裂也會使細菌進入乳房組織，而造成乳腺炎。
http://www.ca2-health.com/obst/2014/10/08/%E4%B9%B3%E8%85%BA%E7%AE%A1%E9%98%BB%E5%A1%9E%E7%85%A7%E8%AD%B7,乳腺管阻塞照護| 中亞健康網- 用心傳遞每一刻為您把關健康人生,乳腺管阻塞照護|
http://www.ca2-health.com/obst/2014/10/08/%E4%B9%B3%E8%85%BA%E7%AE%A1%E9%98%BB%E5%A1%9E%E7%85%A7%E8%AD%B7,乳腺管阻塞照護| 中亞健康網- 用心傳遞每一刻為您把關健康人生,乳腺管阻塞照護
http://www.ca2-health.com/obst/2014/10/08/%E4%B9%B3%E8%85%BA%E7%AE%A1%E9%98%BB%E5%A1%9E%E7%85%A7%E8%AD%B7,乳腺管阻塞照護| 中亞健康網- 用心傳遞每一刻為您把關健康人生,泌乳期乳腺炎護理
http://www.ca2-health.com/obst/2014/10/08/%E4%B9%B3%E8%85%BA%E7%AE%A1%E9%98%BB%E5%A1%9E%E7%85%A7%E8%AD%B7,乳腺管阻塞照護| 中亞健康網- 用心傳遞每一刻為您把關健康人生,哺乳期乳腺炎護理
http://www.ca2-health.com/obst/2014/10/08/%E4%B9%B3%E8%85%BA%E7%AE%A1%E9%98%BB%E5%A1%9E%E7%85%A7%E8%AD%B7,乳腺管阻塞照護| 中亞健康網- 用心傳遞每一刻為您把關健康人生,乳腺管阻塞照護
http://www.ca2-health.com/obst/2014/10/08/%E4%B9%B3%E8%85%BA%E7%AE%A1%E9%98%BB%E5%A1%9E%E7%85%A7%E8%AD%B7,乳腺管阻塞照護| 中亞健康網- 用心傳遞每一刻為您把關健康人生,乳腺管阻塞照護
http://www.ca2-health.com/obst/2014/10/08/%E4%B9%B3%E8%85%BA%E7%AE%A1%E9%98%BB%E5%A1%9E%E7%85%A7%E8%AD%B7,乳腺管阻塞照護| 中亞健康網- 用心傳遞每一刻為您把關健康人生,何謂乳腺管阻塞
http://www.ca2-health.com/obst/2014/10/08/%E4%B9%B3%E8%85%BA%E7%AE%A1%E9%98%BB%E5%A1%9E%E7%85%A7%E8%AD%B7,乳腺管阻塞照護| 中亞健康網- 用心傳遞每一刻為您把關健康人生,當乳房某區塊的乳汁沒有被有效的移出時，鬱積的乳汁會造成此區塊的乳腺管阻塞。
http://www.ca2-health.com/obst/2014/10/08/%E4%B9%B3%E8%85%BA%E7%AE%A1%E9%98%BB%E5%A1%9E%E7%85%A7%E8%AD%B7,乳腺管阻塞照護| 中亞健康網- 用心傳遞每一刻為您把關健康人生,當乳腺管阻塞未能有效的處理時，易發生後續的乳腺炎甚至乳房膿瘍。
http://www.ca2-health.com/obst/2014/10/08/%E4%B9%B3%E8%85%BA%E7%AE%A1%E9%98%BB%E5%A1%9E%E7%85%A7%E8%AD%B7,乳腺管阻塞照護| 中亞健康網- 用心傳遞每一刻為您把關健康人生,造成乳腺管阻塞常見的原因
http://www.ca2-health.com/obst/2014/10/08/%E4%B9%B3%E8%85%BA%E7%AE%A1%E9%98%BB%E5%A1%9E%E7%85%A7%E8%AD%B7,乳腺管阻塞照護| 中亞健康網- 用心傳遞每一刻為您把關健康人生,母親在餵奶時用指頭在靠近嬰兒鼻子的乳暈處施壓，造成此區塊的乳腺管阻塞。
http://www.ca2-health.com/obst/2014/10/08/%E4%B9%B3%E8%85%BA%E7%AE%A1%E9%98%BB%E5%A1%9E%E7%85%A7%E8%AD%B7,乳腺管阻塞照護| 中亞健康網- 用心傳遞每一刻為您把關健康人生,固定餵奶的姿勢或手擠奶在固定的位置，導致其它乳腺管的引流受限。
http://www.ca2-health.com/obst/2014/10/08/%E4%B9%B3%E8%85%BA%E7%AE%A1%E9%98%BB%E5%A1%9E%E7%85%A7%E8%AD%B7,乳腺管阻塞照護| 中亞健康網- 用心傳遞每一刻為您把關健康人生,穿著緊身且含鋼圈胸罩造成壓迫性乳腺管阻塞。
http://www.ca2-health.com/obst/2014/10/08/%E4%B9%B3%E8%85%BA%E7%AE%A1%E9%98%BB%E5%A1%9E%E7%85%A7%E8%AD%B7,乳腺管阻塞照護| 中亞健康網- 用心傳遞每一刻為您把關健康人生,乳腺管阻塞的症狀
http://www.ca2-health.com/obst/2014/10/08/%E4%B9%B3%E8%85%BA%E7%AE%A1%E9%98%BB%E5%A1%9E%E7%85%A7%E8%AD%B7,乳腺管阻塞照護| 中亞健康網- 用心傳遞每一刻為您把關健康人生,乳腺管阻塞剛發生時，母親會感覺到嬰兒吸吮乳房時變得煩躁。
http://www.ca2-health.com/obst/2014/10/08/%E4%B9%B3%E8%85%BA%E7%AE%A1%E9%98%BB%E5%A1%9E%E7%85%A7%E8%AD%B7,乳腺管阻塞照護| 中亞健康網- 用心傳遞每一刻為您把關健康人生,當阻塞一直沒有改善時，母親會發現乳腺管阻塞的區塊會變成硬塊，有脹痛感，甚至皮膚外觀會些微泛紅。
http://www.ca2-health.com/obst/2014/10/08/%E4%B9%B3%E8%85%BA%E7%AE%A1%E9%98%BB%E5%A1%9E%E7%85%A7%E8%AD%B7,乳腺管阻塞照護| 中亞健康網- 用心傳遞每一刻為您把關健康人生,自行處理乳腺管阻塞的方法
http://www.ca2-health.com/obst/2014/10/08/%E4%B9%B3%E8%85%BA%E7%AE%A1%E9%98%BB%E5%A1%9E%E7%85%A7%E8%AD%B7,乳腺管阻塞照護| 中亞健康網- 用心傳遞每一刻為您把關健康人生,單純的乳腺管阻塞不需要任何治療，在24-48小時內會自行消失。
http://www.ca2-health.com/obst/2014/10/08/%E4%B9%B3%E8%85%BA%E7%AE%A1%E9%98%BB%E5%A1%9E%E7%85%A7%E8%AD%B7,乳腺管阻塞照護| 中亞健康網- 用心傳遞每一刻為您把關健康人生,若將白點吸破，乳腺就會通。
http://www.ca2-health.com/obst/2014/10/08/%E4%B9%B3%E8%85%BA%E7%AE%A1%E9%98%BB%E5%A1%9E%E7%85%A7%E8%AD%B7,乳腺管阻塞照護| 中亞健康網- 用心傳遞每一刻為您把關健康人生,要更有效的引流硬塊，可以改變餵奶姿勢，讓嬰兒的下巴貼近硬塊處，藉由嬰兒吸吮時舌頭的蠕動，幫助阻塞的乳腺管暢通。
http://www.ca2-health.com/obst/2014/10/08/%E4%B9%B3%E8%85%BA%E7%AE%A1%E9%98%BB%E5%A1%9E%E7%85%A7%E8%AD%B7,乳腺管阻塞照護| 中亞健康網- 用心傳遞每一刻為您把關健康人生,在嬰兒吸吮乳房或擠奶的同時，可以用指腹輕柔硬塊的外圍，幫助乳腺管暢通。
http://www.ca2-health.com/obst/2014/10/08/%E4%B9%B3%E8%85%BA%E7%AE%A1%E9%98%BB%E5%A1%9E%E7%85%A7%E8%AD%B7,乳腺管阻塞照護| 中亞健康網- 用心傳遞每一刻為您把關健康人生,預防乳腺管阻塞的建議措施
http://www.ca2-health.com/obst/2014/10/08/%E4%B9%B3%E8%85%BA%E7%AE%A1%E9%98%BB%E5%A1%9E%E7%85%A7%E8%AD%B7,乳腺管阻塞照護| 中亞健康網- 用心傳遞每一刻為您把關健康人生,以乳房舒適狀況而定，若遇到嬰兒不認真吸吮或睡眠過長，可以先行以手擠奶，幫助減輕乳腺管的腫脹，減少乳腺管發生阻塞。
http://www.ca2-health.com/obst/2014/10/08/%E4%B9%B3%E8%85%BA%E7%AE%A1%E9%98%BB%E5%A1%9E%E7%85%A7%E8%AD%B7,乳腺管阻塞照護| 中亞健康網- 用心傳遞每一刻為您把關健康人生,當乳腺管阻塞發生時，建議應至少每三小時擠奶，擠奶時間約30-60分鐘即可。
http://www.ca2-health.com/obst/2014/10/08/%E4%B9%B3%E8%85%BA%E7%AE%A1%E9%98%BB%E5%A1%9E%E7%85%A7%E8%AD%B7,乳腺管阻塞照護| 中亞健康網- 用心傳遞每一刻為您把關健康人生,學習手擠奶的技巧是很重要的，手擠奶可以幫助疏通乳腺管改善乳暈處腫脹。
http://www.ca2-health.com/obst/2014/10/08/%E4%B9%B3%E8%85%BA%E7%AE%A1%E9%98%BB%E5%A1%9E%E7%85%A7%E8%AD%B7,乳腺管阻塞照護| 中亞健康網- 用心傳遞每一刻為您把關健康人生,建議每天水分攝取至少1500CC以及減少攝取油膩、高熱量飲食(如高湯、麻油雞酒或花生燉豬腳等)，可以預防乳汁過度黏稠造成乳腺管阻塞。
http://www.ca2-health.com/obst/2014/10/08/%E4%B9%B3%E8%85%BA%E7%AE%A1%E9%98%BB%E5%A1%9E%E7%85%A7%E8%AD%B7,乳腺管阻塞照護| 中亞健康網- 用心傳遞每一刻為您把關健康人生,泌乳期乳腺炎護理
http://www.ca2-health.com/obst/2014/10/08/%E4%B9%B3%E8%85%BA%E7%AE%A1%E9%98%BB%E5%A1%9E%E7%85%A7%E8%AD%B7,乳腺管阻塞照護| 中亞健康網- 用心傳遞每一刻為您把關健康人生,當產後哺乳婦女，乳房腫脹或乳腺管阻塞未能有效的處理時，容易成為乳腺炎。
