URL,Title,Sentence
https://ebenezer.pixnet.net/blog/post/147402912,人腦的電腦觀@ Han-Wen探索分享體驗世界:: 痞客邦::,同時，也必須認同一點，以模仿人腦方式所做出來的生物電腦，不可能與現在的人腦相同。
https://ebenezer.pixnet.net/blog/post/147402912,人腦的電腦觀@ Han-Wen探索分享體驗世界:: 痞客邦::,再說，用生物電腦方式所作出的腦，即使有一天會「出現」，但是，人腦是否能完全了解人腦？好像是數學的存在定理那樣，或許會耗費無限長的時間也未可知。
https://ebenezer.pixnet.net/blog/post/147402912,人腦的電腦觀@ Han-Wen探索分享體驗世界:: 痞客邦::,腦是人類進化的歷史性產物，演化的過程至少有四十億年，那麼到底能有多少個億年允許人類去仿製一個像人腦一樣的人工腦呢？到那時，人類的歷史說不定早已終止，而地球是否存在也還是未知數！儘管如此，若只就仿製一具與人腦相近的生物電腦而言，也就是說它的功能與人腦有相當程度的接近，事實上現在我們可以說已經做到了一部分。
https://ebenezer.pixnet.net/blog/post/147402912,人腦的電腦觀@ Han-Wen探索分享體驗世界:: 痞客邦::,用電腦的觀點來研究人腦，積極開始於1960年代，而目前更為流行。
https://ebenezer.pixnet.net/blog/post/147402912,人腦的電腦觀@ Han-Wen探索分享體驗世界:: 痞客邦::,但是電腦與人腦之間，仍有著一段相當大的差距，應該是無可置疑的。
https://ebenezer.pixnet.net/blog/post/147402912,人腦的電腦觀@ Han-Wen探索分享體驗世界:: 痞客邦::,不過，在目前這個發展生物電腦的緊要關頭，應該提醒大家注意的是，我們在全力研究及開拓新一代電腦原理的同時，不要忘了努力地去向人腦學習全新的理論，才能掌握未來新的研究方向。
https://ebenezer.pixnet.net/blog/post/147402912,人腦的電腦觀@ Han-Wen探索分享體驗世界:: 痞客邦::,人類在四十億年進化歷程中所演化成的終極產品──人腦，一定是最經濟而又有效率的。
https://ebenezer.pixnet.net/blog/post/147402912,人腦的電腦觀@ Han-Wen探索分享體驗世界:: 痞客邦::,"但是，至少我們應該立即朝著一個明確的目標進行，試著從工程學的觀點，去研究腦的機能，了解它的解題和算則（algorithm）及分析它的結構（architecture），則雖不中所差也不過十萬七千里矣！人腦的硬體人腦重約1.4公斤，容積約1.4公升，從每個腦細胞的大小約為10-10～10-11公升估計，腦細胞總數可能在140億～1,400億之間。"
https://ebenezer.pixnet.net/blog/post/147402912,人腦的電腦觀@ Han-Wen探索分享體驗世界:: 痞客邦::,"一個神經元具有約數百至數千個神經突觸（synapse），整個人腦中則有約1,000億個突觸。"
https://ebenezer.pixnet.net/blog/post/147402912,人腦的電腦觀@ Han-Wen探索分享體驗世界:: 痞客邦::,若一個神經元與一個大型積體電路（LSI）相當，則應把神經突觸，而非神經元，看作是人腦的一個運算單元。
https://ebenezer.pixnet.net/blog/post/147402912,人腦的電腦觀@ Han-Wen探索分享體驗世界:: 痞客邦::,又，人腦的記憶容量與它所具有的神經元數目相當，前面提到腦中的神經元約有數億個，則把神經元換算成為相當的神經突觸數後，再計算它的記憶容量的位元數，將是非常之大。
https://ebenezer.pixnet.net/blog/post/147402912,人腦的電腦觀@ Han-Wen探索分享體驗世界:: 痞客邦::,人腦中資訊的傳遞，已被認為不僅是一種電的通信，同時還受到一種化學物質的控制（或稱為化學通信，見下文）。
https://ebenezer.pixnet.net/blog/post/147402912,人腦的電腦觀@ Han-Wen探索分享體驗世界:: 痞客邦::,人腦的資訊系統從上面我們知道，一個腦神經細胞或神經元相當於一個大型積體電路，它含有數百個乃至數千個神經突觸，每個突觸可看作是一個運算單元，擔任一項基本運算，因此一個神經元便可擔任一項特定的運算功能。
https://ebenezer.pixnet.net/blog/post/147402912,人腦的電腦觀@ Han-Wen探索分享體驗世界:: 痞客邦::,一、神經元的基本結構與神經脈衝的形成人腦是神經系統演化的最高峰，從簡單的反射動作，到人類的複雜行為及心理現象，全賴這些神經元活動與交互協調產生。
https://ebenezer.pixnet.net/blog/post/147402912,人腦的電腦觀@ Han-Wen探索分享體驗世界:: 痞客邦::,不過，最近電腦界為第五代電腦的設計，正積極模仿我們人腦的神經系統，展開對平行操作系統（parallelsystem）理論的研究。
https://ebenezer.pixnet.net/blog/post/147402912,人腦的電腦觀@ Han-Wen探索分享體驗世界:: 痞客邦::,人腦的結構與中央處理單位一、人腦的結構及其主要功能人腦是由約數億個神經元所組成，不論是低等動物或高等動物，神經元的構造都相同。
https://ebenezer.pixnet.net/blog/post/147402912,人腦的電腦觀@ Han-Wen探索分享體驗世界:: 痞客邦::,高等動物如人腦的不同處，是在操作單元──神經元數目增多，單元與單元間的連繫更複雜，形成更周密的並行資訊網路系統。
https://ebenezer.pixnet.net/blog/post/147402912,人腦的電腦觀@ Han-Wen探索分享體驗世界:: 痞客邦::,人腦的結構依其主要功能大致可分為四部分（見圖五）：1.脊髓，由神經網路組成，處理單純的反射式資訊，如手一碰觸冷的物體便立即自動縮回，無需經過大腦的意識作用。
https://ebenezer.pixnet.net/blog/post/147402912,人腦的電腦觀@ Han-Wen探索分享體驗世界:: 痞客邦::,二、人腦的中央處理單位（CPU）有關人腦對資訊的處理，必須從兩方面來說明。
https://ebenezer.pixnet.net/blog/post/147402912,人腦的電腦觀@ Han-Wen探索分享體驗世界:: 痞客邦::,換句話說，輸入於人腦的資訊，能存入於記憶中不過1％。
https://ebenezer.pixnet.net/blog/post/147402912,人腦的電腦觀@ Han-Wen探索分享體驗世界:: 痞客邦::,三、人腦的記憶系統人腦對資訊的處理如圖六所示，先將由感覺器官所獲得的輸入資訊，經分析、綜合、認知後，或直接送入記憶部門，或經由思考及與原有記憶比對後，重新認知再存入記憶部門，或確定行動計畫，下達指令，經由輸出控制部門，採取行動。
https://ebenezer.pixnet.net/blog/post/147402912,人腦的電腦觀@ Han-Wen探索分享體驗世界:: 痞客邦::,一個突觸最多相當於幾位元的資訊量，而腦的最大記憶容量可達1016位元，人腦中的突觸數約在1011～1012之間，加以折算，一個突觸至少要等於106位元的資訊量，事實上是絕對不可能。
https://ebenezer.pixnet.net/blog/post/147402912,人腦的電腦觀@ Han-Wen探索分享體驗世界:: 痞客邦::,再說，人腦神經細胞的數目，出生後即已確定，不能再生，成年後每天約死亡十萬個，可是人腦對處理資訊的能力，並未逐日遞減，而經由神經網路功能的加強去彌補，並將一生中各種學習經驗記入遺傳因子，而深銘腦海之中。
https://ebenezer.pixnet.net/blog/post/147402912,人腦的電腦觀@ Han-Wen探索分享體驗世界:: 痞客邦::,若腦的記憶也比照這個方式寫入DNA中，則在109個腦神經細胞的DNA中，可寫入的資訊量可達109×1010＝1019位元，亦即為人腦一生可能處理的總資訊量，其中，0.1％的資訊，即1016位元，可能存入長期記憶中。
https://ebenezer.pixnet.net/blog/post/147402912,人腦的電腦觀@ Han-Wen探索分享體驗世界:: 痞客邦::,不過，長期記憶如何在剎那間存取，例如老年人可在一眨眼間回憶起兒時的種種，其速度為何如此之快，仍將是一個待解的謎！人腦的軟體？若就資訊處理裝置的觀點來看，人腦與電腦在根本上就有許多不同的地方。
https://ebenezer.pixnet.net/blog/post/147402912,人腦的電腦觀@ Han-Wen探索分享體驗世界:: 痞客邦::,人腦的硬體是由神經元網路組成，並且是一種以並聯及分散方式處理資訊的裝置，而電腦則是以時間順序方式處理資訊，兩者迥然不同。
https://ebenezer.pixnet.net/blog/post/147402912,人腦的電腦觀@ Han-Wen探索分享體驗世界:: 痞客邦::,並且，人腦已具有自我學習能力，可視需要而隨時調整神經網路的連續，對資訊作最適當的處理。
https://ebenezer.pixnet.net/blog/post/147402912,人腦的電腦觀@ Han-Wen探索分享體驗世界:: 痞客邦::,因此，人腦的硬體與軟體兩者乃是一種不可分割的一體協調動作，而電腦則否。
https://ebenezer.pixnet.net/blog/post/147402912,人腦的電腦觀@ Han-Wen探索分享體驗世界:: 痞客邦::,人腦對輸入資訊的並行處理模式，大致可以用圖七表示。
https://ebenezer.pixnet.net/blog/post/147402912,人腦的電腦觀@ Han-Wen探索分享體驗世界:: 痞客邦::,人腦對外界物體的認知與分析，是透過左腦語言中心的翻譯後，將所獲得事物的資訊分成「大小」、「形狀」與「顏色」三組分別加以儲存，或與原有經由學習所獲得的檔案加以比對後予以分析。
https://ebenezer.pixnet.net/blog/post/147402912,人腦的電腦觀@ Han-Wen探索分享體驗世界:: 痞客邦::,依據聯想記憶模型人腦的記憶系統，為一並行式的分散聯想記憶結構，在一個神經元網路中，儲有許多個關連的重合式的記憶圖型，因此，人類才能達到所謂舉一反三或觸一髮而動全身的聯想（鎖）功能。
https://ebenezer.pixnet.net/blog/post/147402912,人腦的電腦觀@ Han-Wen探索分享體驗世界:: 痞客邦::,這種重合式的記憶圖型，可經常透過人腦的自我組識功能，而在混亂中整理出脈絡，加以「取」或「捨」。
https://ebenezer.pixnet.net/blog/post/147402912,人腦的電腦觀@ Han-Wen探索分享體驗世界:: 痞客邦::,我們對人腦的軟體及記憶功能，到目前為止，雖然有多種模型提出，但所知道的還是太少。
https://ebenezer.pixnet.net/blog/post/147402912,人腦的電腦觀@ Han-Wen探索分享體驗世界:: 痞客邦::,雖然，對於人腦記憶裝置的空間模型，已有若干架構，但是，對於記憶的時間模型以及它是如何定著於神經網路中，還是茫然不知。
https://ebenezer.pixnet.net/blog/post/147402912,人腦的電腦觀@ Han-Wen探索分享體驗世界:: 痞客邦::,其中，模仿自然界已演化達40億年的人腦，應該是未來發展更新一代電腦的終極目標。
https://ebenezer.pixnet.net/blog/post/147402912,人腦的電腦觀@ Han-Wen探索分享體驗世界:: 痞客邦::,茲綜以上所述，從人腦的電腦觀點，列舉未來生物型電腦發展的方向如下：一、模仿生物體元件開發新的分子或生物功能元件。
https://ebenezer.pixnet.net/blog/post/147402912,人腦的電腦觀@ Han-Wen探索分享體驗世界:: 痞客邦::,三、借用人腦的軟體解題及運算方式。
https://ebenezer.pixnet.net/blog/post/147402912,人腦的電腦觀@ Han-Wen探索分享體驗世界:: 痞客邦::,四、模仿人腦能自我組織的軟體。
https://ebenezer.pixnet.net/blog/post/147402912,人腦的電腦觀@ Han-Wen探索分享體驗世界:: 痞客邦::,五、學習人腦的記憶模式。
https://ebenezer.pixnet.net/blog/post/147402912,人腦的電腦觀@ Han-Wen探索分享體驗世界:: 痞客邦::,總而言之，不外乎取電腦與人腦兩者之長，例如取電腦的速度與邏輯運算，與人腦的動態記憶或自我組織系統，而捨其短。
https://scitechvista.nat.gov.tw/c/sTzs.htm,從果蠅了解人腦，從小見大，以簡破繁！學習腦科學，頭好壯壯 ...,從果蠅了解人腦，從小見大，以簡破繁！學習腦科學，頭好壯壯－科技大觀園
https://scitechvista.nat.gov.tw/c/sTzs.htm,從果蠅了解人腦，從小見大，以簡破繁！學習腦科學，頭好壯壯 ...,首頁>從果蠅了解人腦，從小見大，以簡破繁！學習腦科學，頭好壯壯
https://scitechvista.nat.gov.tw/c/sTzs.htm,從果蠅了解人腦，從小見大，以簡破繁！學習腦科學，頭好壯壯 ...,從果蠅了解人腦，從小見大，以簡破繁！學習腦科學，頭好壯壯
https://scitechvista.nat.gov.tw/c/sTzs.htm,從果蠅了解人腦，從小見大，以簡破繁！學習腦科學，頭好壯壯 ...,▲科學家透過研究果蠅的大腦，來了解人腦的運作。
https://scitechvista.nat.gov.tw/c/sTzs.htm,從果蠅了解人腦，從小見大，以簡破繁！學習腦科學，頭好壯壯 ...,然而人腦的錯綜複雜遠超過大家想像，美國神經科學學會2年前邀請全球頂尖科學家共同研究評估，即使是利用最先進的電子顯微鏡做連續切片，大概要700萬年才能破解人類腦神經網路圖譜。
https://scitechvista.nat.gov.tw/c/sTzs.htm,從果蠅了解人腦，從小見大，以簡破繁！學習腦科學，頭好壯壯 ...,在AI科技出現突破性發展前，科學家採取「從小見大，以簡破繁」的迂迴策略，利用果蠅研究昆蟲的腦部如何跟環境互動、控制身體行動，進而達到對人腦的了解。
https://scitechvista.nat.gov.tw/c/sTzs.htm,從果蠅了解人腦，從小見大，以簡破繁！學習腦科學，頭好壯壯 ...,江安世帶領研究團隊在蟑螂身上找到NMDA（麩氨）膜蛋白，並證實果蠅的學習與記憶跟人類同樣需要NMDA接受器，奠定了生物從最基本的昆蟲到人腦，神經細胞作用機制都類似的科學基礎，開啟全球破解果蠅腦神經網路圖譜研究風潮。
https://scitechvista.nat.gov.tw/c/sTzs.htm,從果蠅了解人腦，從小見大，以簡破繁！學習腦科學，頭好壯壯 ...,從了解果蠅腦到了解人腦，用假記憶治療不好的記憶
https://scitechvista.nat.gov.tw/c/sTzs.htm,從果蠅了解人腦，從小見大，以簡破繁！學習腦科學，頭好壯壯 ...,「研究果蠅最終的目的是了解人腦。
http://trh.gase.most.ntnu.edu.tw/tw/article/content/119,人腦網絡連結體影像與應用-生命科學:臺灣研究亮點,人腦網絡連結體影像與應用-生命科學:臺灣研究亮點
http://trh.gase.most.ntnu.edu.tw/tw/article/content/119,人腦網絡連結體影像與應用-生命科學:臺灣研究亮點,人腦網絡連結體影像與應用
http://trh.gase.most.ntnu.edu.tw/tw/article/content/119,人腦網絡連結體影像與應用-生命科學:臺灣研究亮點,:::首頁/生命科學/人腦網絡連結體影像與應用
http://trh.gase.most.ntnu.edu.tw/tw/article/content/119,人腦網絡連結體影像與應用-生命科學:臺灣研究亮點,人腦是一個複雜的神經網絡，即腦連結體(Connectome)，由微觀的細胞形態到宏觀的整體運作形成高效的網絡系統支持各種訊息的處理與整合。
http://trh.gase.most.ntnu.edu.tw/tw/article/content/119,人腦網絡連結體影像與應用-生命科學:臺灣研究亮點,近二十餘年以來，非侵入式腦影像技術的快速發展，使學者可於活體上觀察神經連結的角色與功能，並進而一窺人腦運行奧秘，更有大量證據表明偏差的網絡連結直接導致行為變異或神經、精神病患的臨床表徵。
http://trh.gase.most.ntnu.edu.tw/tw/article/content/119,人腦網絡連結體影像與應用-生命科學:臺灣研究亮點,為提升人類健康並推進人工智慧技術，近年來，國際腦科學計畫更加強力道，大幅推進各式影像技術，但為解決各式腦科學與臨床問題且遵循人腦實驗規範，儀器規格、影像技術、方法學各方面仍存在相當多挑戰，這也正是陽明大學「腦連結實驗室，BrainConnectivitylab」16年來所努力的目標。
http://trh.gase.most.ntnu.edu.tw/tw/article/content/119,人腦網絡連結體影像與應用-生命科學:臺灣研究亮點,基於這些基礎及跨領域腦科學、臨床整合研究，得以建立相當穩定可靠的人腦連結體訊息，並深入探討認知與神經、精神疾病等及其遺傳相關的腦網絡連接體關聯，取得了系列成果，增進對人腦連結體於行為、發育、老化、病變機理、腦損害等特徵和腦重組機制的認識，為人腦運作機理與疾病防治提供了量化指標與科學依據。
http://trh.gase.most.ntnu.edu.tw/tw/article/content/119,人腦網絡連結體影像與應用-生命科學:臺灣研究亮點,人腦是生物演化的奇蹟，它是由數百種不同類型的上千億個神經細胞所構成之極為複雜的生物組織。
http://trh.gase.most.ntnu.edu.tw/tw/article/content/119,人腦網絡連結體影像與應用-生命科學:臺灣研究亮點,在這樣前提下，人腦連結體計畫(BrainConnectomeProject)被歐美先進國家率先提出，並嘗試以新式影像方式定位人腦的神經連結與活動，意圖解開人腦運作奧祕。
http://trh.gase.most.ntnu.edu.tw/tw/article/content/119,人腦網絡連結體影像與應用-生命科學:臺灣研究亮點,由於神經訊息的連結與動態活動直接影響個體認知與表現，而偏差的網絡連結更直接導致神經、精神病患的行為變異及臨床表徵，美國NIMH主席ThomasInsel曾指出：神經精神疾病的本質是人腦網絡連接紊亂，從人腦網絡連接角度研究神經精神疾病具有重要意義。
http://trh.gase.most.ntnu.edu.tw/tw/article/content/119,人腦網絡連結體影像與應用-生命科學:臺灣研究亮點,林教授於博士就學時期，適逢神經影像技術發展之初，便一頭栽入相關研究工作，迄今二十餘年，並創立陽明大學「腦連結實驗室」，專注於神經影像技術研發、優化、驗證與標準制訂，並積極參與近年蓬勃發展的腦網絡連結體研究，成果相當豐碩，深入探討認知與神經、精神疾病等與其遺傳相關的腦網絡連接體關聯，取得了系列成果，增進對人腦連結體於行為、發育、老化、病變機理、腦損害等特徵和腦重組機制的認識，為腦運作機理與疾病防治提供了科學依據。
http://trh.gase.most.ntnu.edu.tw/tw/article/content/119,人腦網絡連結體影像與應用-生命科學:臺灣研究亮點,除此之外，為提升國人健康並協助臨床服務，近期代表工作方向有四：首先是基於長期神經影像工作積累，我們發明了新式神經影像演算法，可精準以影像方式取得人腦神經束三維走向與網絡，以及其與腦傷、腦瘤等組織關聯性，此項目已分別於2018及2019年取得台灣與美國專利，目前正技轉並應用於神經外科的術前規劃、術中定位與術後評估等三維影像輔助，協助神經外科的精準治療。
http://trh.gase.most.ntnu.edu.tw/tw/article/content/119,人腦網絡連結體影像與應用-生命科學:臺灣研究亮點,綜上，陽明大學「腦連結實驗室」已於人腦連結體取得系列研究成果，並逐漸受到國際專家學者肯定，近期更嘗試建立高維人腦連結圖譜與人工智慧技術，深入探討人腦功能機理，並為各式腦疾病提供預測、早期診斷、治療輔助等，為國人健康與腦科學研究盡一份心力。
https://theme.udn.com/theme/story/6775/4214063,擁有人腦的猴子誕生！全球科學界砲轟這國亂搞| 互動知國際 ...,擁有人腦的猴子誕生！全球科學界砲轟這國亂搞|
https://theme.udn.com/theme/story/6775/4214063,擁有人腦的猴子誕生！全球科學界砲轟這國亂搞| 互動知國際 ...,願景時尚汽車NBA台灣運動筆記棒協遊戲國際鳴人堂新鮮事u值媒全部願景新聞經濟日報噓星聞時尚汽車NBA運動筆記健行筆記野球夢田遊戲國際鳴人堂部落格u值媒元氣話題倡議讀書吧讀小說讀創故事優人物500輯知識庫電子報基金房地產影音數位文創有設計IP授權瘋活動售票網中經社買東西展覽有行旅聯合文學聯經出版聯文雜誌世界日報聯合學苑App多媒體看時事攝記現場新知便利貼udn/時事話題/多媒體看時事/互動知國際相關新聞為國抗疫還被收隔離費…副鎮長丟官誰該付錢輿論還在戰台灣是防疫模範生！CNN大讚：這10點全世界都該好好學SARS、MERS到新冠...疫苗為何難產病毒學家一句話告訴你打臉官媒抗疫暖新聞醫界蔡康永爆紅…只因說實話伊朗疫情為何慘重？宗教舔舌傳統太難禁…這些人要注意了得流感可能比得新冠肺炎更要命蝗災該怎辦？古代牧鴨滅蝗為何這次無效？美3千萬抗疫邊緣人？這職場文化怎擋瘟疫抗疫護士的卑微心願…想要個男友條件開出網暴動疫情吹高官危！美吹哨者被威脅、衛生機構遭禁言…義大利疫情怪象！病毒引爆心魔重災區外民眾更剉沒染疫卻被送進重症室？醫師知道原因快崩潰了中日關係變好不是因為疫情！是一個男人跟一場戰爭武漢版「愛在瘟疫蔓延時」...她的一雙眼，治癒了他的新冠肺炎？南韓疫情失控！新天地教會這奇特想法闖了大禍大陸黑科技防疫…效果還不知為何國外已喊讚機票漲10倍2大關鍵因素...韓國人仍搶去大陸避疫隔離嚴謹專家猛讚新加坡防疫…2原因台灣學不來陸「咳嗽發燒」才發現這些頂級賽事淘金滿分、應變0分上崗就賞3萬1！鴻海重金拚復工率為何專家卻超不樂觀？疫情太可疑！1名研究員生死為何大陸瘋狂熱議？印尼為何零疫情？衛生部長解玄機…但你未必做得到肺炎讓全世界都反中？日本民眾這些話讓台灣立場好尷尬...靠它殺病毒？川習說撐到4月有好事卻忘了一件事只因「黃皮膚」就被打？以防疫為名的歧視歐美正在上演新加坡防疫零容忍…為何仍淪重災區原因竟跟反送中有關全球防疫致命破綻！當年登革熱死逾千人這國政府被點名...新冠肺炎三周定生死！封城後中共開始強調「網格化管理」明星穿進奧斯卡的禮服…多數還給設計師就她全買下來防疫防到走火入魔？為求安全互相舉報外來人口流落街頭...全面禁止中國人入境！外貿原料全靠鄰居北韓哪來的底氣？武漢封城記：囚居海鮮市場旁一個動作救了他全家日人超不爽安倍！2件事他做法和蔡政府一樣…小民買不到大官隨便拿？肺炎爆發的推手原來在這裡...歧視比疫情更猛這些國家正在助長偏見…哈利梅根可能住這居民被教「像養貓一樣對待他們」脫歐漁權戰開打英寸土不讓和攸關國威的這4字有關當新型病毒席捲城市...9成病原體未記錄BBC：災難才剛開始五大門派傳祕招！居家防疫獨門好康外面享不到拿武漢肺炎歧視黃種人！歐洲霸凌總動員無法想像…繳回英王室頭銜…為何哈利吃3大虧？算給你聽韓片寄生上流難賣座？原來美國人有「2.5公分障礙」擁有人腦的猴子誕生！全球科學界砲轟這國亂搞分享分享留言列印A-A+2019-12-0911:00:00聯合報記者賴錦宏／綜合報導用LINE傳送示意圖／翻攝自視覺中國facebook英國「新科學家」雜誌6日獨家報導，大陸幹細胞研究團隊創造出全球首見的「豬猴嵌合體」，雖然這2隻猴豬合體動物出生1周後，便由於不明原因死亡，但中國大陸的科學實驗違反生物倫理再度被世界科學家熱議。
https://theme.udn.com/theme/story/6775/4214063,擁有人腦的猴子誕生！全球科學界砲轟這國亂搞| 互動知國際 ...,美國加州「沙克研究所」2017年曾創造出「人豬嵌合體」後，隨即招致「豬腦帶有人類基因（豬長出人腦）」等質疑。
https://theme.udn.com/theme/story/6775/4214063,擁有人腦的猴子誕生！全球科學界砲轟這國亂搞| 互動知國際 ...,（法新社）facebook●人腦級猴子再爆倫理爭議今年4月，大陸科學家培育出11隻攜有人類基因的恒河猴，這些猴子的大腦發育表現出接近人類大腦發育的特徵，只存活了5隻。
https://dq.yam.com/post.php?id=9351,人腦為什麼這麼「大」？ | DQ 地球圖輯隊帶你看透全世界,人腦為什麼這麼「大」？|
https://dq.yam.com/post.php?id=9351,人腦為什麼這麼「大」？ | DQ 地球圖輯隊帶你看透全世界,人腦為什麼這麼「大」？
https://dq.yam.com/post.php?id=9351,人腦為什麼這麼「大」？ | DQ 地球圖輯隊帶你看透全世界,人腦為什麼這麼大
https://dq.yam.com/post.php?id=9351,人腦為什麼這麼「大」？ | DQ 地球圖輯隊帶你看透全世界,以動物來說，人類(智人)的腦袋真的是非常大，人腦尺寸大約是其他哺乳類動物的六倍之大，和猿人、直立人相較之下，智人的腦袋也是他們的三倍大，而且人體內有20%的能量都是被我們的大腦消耗掉的。
https://dq.yam.com/post.php?id=9351,人腦為什麼這麼「大」？ | DQ 地球圖輯隊帶你看透全世界,電腦統計出來的結果發現，影響人腦大小的因素有60%是來自於一個人解決在環境遇到的問題，例如：覓食、料理或儲存食物、製作工具等；另外有30%是人們互助合作共同解決在生活中遇到的問題，像是一起打獵；最後的10%才是人和人之間的競爭。
https://dq.yam.com/post.php?id=9351,人腦為什麼這麼「大」？ | DQ 地球圖輯隊帶你看透全世界,也就是說，人腦的大小比起社會性因素，環境壓力的影響力更高。
